{"app":{"reference":"python-cli","src":"target-architecture.json#reference"},"contract":1,"counts":{"introduce":{"src":"target-architecture.json#infrastructure[present=false] (count)","unit":"count","value":4},"keep":{"src":"target-architecture.json#infrastructure[present=true] (count)","unit":"count","value":2},"lanes_found":{"src":"lanes[state=measured] (count)","unit":"count","value":0},"nodes":{"src":"lanes[].nodes + folded (count)","unit":"count","value":0},"target_silent":{"src":"target.lanes[state=not_measured] (count)","unit":"count","value":3}},"lanes":[{"count":{"src":"facts/runtime.json#deployment_target (distinct nodes)","unit":"count","value":0},"folded":[],"id":"hosting","nodes":[],"reason":"nothing_found","relation":"deployed_to","state":"empty"},{"count":{"src":"facts/runtime.json#ci_step (distinct nodes)","unit":"count","value":0},"folded":[],"id":"ci","nodes":[],"reason":"nothing_found","relation":"built_by","state":"empty"},{"count":{"src":"facts/config.json#env_read (names) + config_file_unread (distinct nodes)","unit":"count","value":0},"folded":[],"id":"environments","nodes":[],"reason":"nothing_found","relation":"configured_by","state":"empty"},{"count":{"src":"facts/entrypoints.json#data_access[client=supabase] + facts/resolve.json#module_edge[EXTERNAL] + facts/domain.json#data_table + facts/runtime.json#migration_step (distinct nodes)","unit":"count","value":0},"folded":[],"id":"databases","nodes":[],"reason":"nothing_found","relation":"stores_in","state":"empty"},{"count":{"src":"facts/resolve.json#module_edge[EXTERNAL] matched against eaos/report/studio/infra.py PACKAGES (distinct nodes)","unit":"count","value":0},"folded":[],"id":"queues","nodes":[],"reason":"no_known_queue_library","relation":"queues_on","state":"empty"},{"count":{"src":"facts/runtime.json#integration_target + resilience_policy + facts/resolve.json#module_edge[EXTERNAL] (distinct nodes)","unit":"count","value":0},"folded":[],"id":"services","nodes":[],"reason":"nothing_found","relation":"calls","state":"empty"},{"count":{"src":"facts/runtime.json#observability_signal + facts/resolve.json#module_edge[EXTERNAL] (distinct nodes)","unit":"count","value":0},"folded":[],"id":"observability","nodes":[],"reason":"nothing_found","relation":"reports_to","state":"empty"}],"provenance":{"assistant":null,"at":null,"confidence":null,"departures":[],"message":{"ar":"المثالي المعروض هو هدف القواعد، وما خُطِّط بعد: أعد تخطيطه من مركز التحكم بمساعدك (Claude Code أو Codex).","en":"The ideal shown is the rules' target. It is not planned yet: re-plan it from the command centre with your assistant (Claude Code or Codex)."},"method":"rules","model":null,"open_questions":[],"state":"not_planned"},"revision":2,"schema_version":1,"src":{"ci":"facts/runtime.json#ci_step","databases":"facts/entrypoints.json#data_access[client=supabase] + facts/resolve.json#module_edge[EXTERNAL] + facts/domain.json#data_table + facts/runtime.json#migration_step","environments":"facts/config.json#env_read (names) + config_file_unread","hosting":"facts/runtime.json#deployment_target","observability":"facts/runtime.json#observability_signal + facts/resolve.json#module_edge[EXTERNAL]","queues":"facts/resolve.json#module_edge[EXTERNAL] matched against eaos/report/studio/infra.py PACKAGES","services":"facts/runtime.json#integration_target + resilience_policy + facts/resolve.json#module_edge[EXTERNAL]","target":"target-architecture.json#infrastructure"},"target":{"lanes":[{"id":"hosting","items":[],"reason":"target_silent","state":"not_measured"},{"id":"ci","items":[{"area":"ci","decision":"Introduce: Tests on every push, on every supported Python. Why: A change breaks an older interpreter unseen.","evidence":"0 CI step(s) in the repository","op":"introduce","present":false,"tool":"GitHub Actions + pre-commit"},{"area":"tests","decision":"Introduce: Unit tests plus approval tests of command output. Why: Output is the tool's interface.","evidence":"0 test file(s)","op":"introduce","present":false,"tool":"pytest + ApprovalTests"}],"reason":"decided","state":"measured"},{"id":"environments","items":[{"area":"configuration","decision":"Keep: Flags and one config file, validated at start. The check: Every invalid setting exits with code 2 and its name.","evidence":"the environment is read in 0 file(s)","op":"keep","present":true,"tool":null},{"area":"secrets","decision":"Keep: Tokens from the environment or keychain only. The check: No credential in the repository.","evidence":"0 secret-class credential(s) committed","op":"keep","present":true,"tool":null}],"reason":"decided","state":"measured"},{"id":"databases","items":[{"area":"data","decision":"Introduce: Inputs and outputs in documented formats with versions. Why: A format change breaks scripts that call the tool.","evidence":"typed schema source: none","op":"introduce","present":false,"tool":null}],"reason":"decided","state":"measured"},{"id":"queues","items":[],"reason":"target_silent","state":"not_measured"},{"id":"services","items":[],"reason":"target_silent","state":"not_measured"},{"id":"observability","items":[{"area":"observability","decision":"Introduce: Exit codes that mean something, and --verbose logging. Why: A script calling the tool needs to know what failed.","evidence":"0 observability signal(s)","op":"introduce","present":false,"tool":null}],"reason":"decided","state":"measured"}],"reference":"python-cli","status":"REVIEW_REQUIRED"}}